{
  "$schema": "https://json-schema.org/draft/2020-12/schema",
  "$id": "https://kristal.example/contracts/release-manifest.schema.json",
  "title": "Kristal Farms Data Release Manifest",
  "type": "object",
  "required": [
    "release_version",
    "generated_at",
    "policy_version",
    "artifacts",
    "qa"
  ],
  "properties": {
    "release_version": {
      "type": "string"
    },
    "generated_at": {
      "type": "string",
      "format": "date-time"
    },
    "database_migration": {
      "type": [
        "string",
        "null"
      ]
    },
    "policy_version": {
      "type": "string"
    },
    "collections": {
      "type": "array",
      "items": {
        "type": "string"
      },
      "uniqueItems": true
    },
    "artifacts": {
      "type": "array",
      "items": {
        "type": "object",
        "required": [
          "path",
          "sha256",
          "classification"
        ],
        "properties": {
          "path": {
            "type": "string"
          },
          "sha256": {
            "type": "string"
          },
          "classification": {
            "enum": [
              "public",
              "partner",
              "internal",
              "restricted"
            ]
          }
        },
        "additionalProperties": false
      }
    },
    "qa": {
      "type": "object",
      "required": [
        "passed"
      ],
      "properties": {
        "passed": {
          "type": "boolean"
        },
        "report": {
          "type": [
            "string",
            "null"
          ]
        }
      },
      "additionalProperties": true
    }
  },
  "additionalProperties": false
}
